{
  "schemaVersion": "evaluation-scenario.v1",
  "scenarioId": "TS-ID-104",
  "revision": "1",
  "contentDigest": "sha256:8a3a7b9063a2e482bf4afcd30a2f72c114022e16214651a66313687bc9cf271c",
  "title": "Nickname plus current public handle",
  "purpose": "Present inspectable connecting clues while keeping the final identity choice human-owned.",
  "suiteIds": [
    "initial-coverage-36"
  ],
  "riskTier": "p2_quality",
  "lifecycle": "active",
  "adjudication": "unreviewed",
  "partition": "dev",
  "dataPolicy": {
    "dataClass": "synthetic_shareable",
    "containsRealCandidateData": false,
    "projection": "synthetic_content_opt_in"
  },
  "modelInputRef": {
    "fixtureId": "model-input:TS-ID-104:r1",
    "path": "evals/v2/fixtures/model-inputs/ts-id-104.r1.json",
    "contentDigest": "sha256:2a196a968a4ecac33612eabae9f4125486b05159ce5b2f16aea5bed068482c8f"
  },
  "initialStateRef": {
    "fixtureId": "initial-state:TS-ID-104:r1",
    "path": "evals/v2/fixtures/initial-state/ts-id-104.r1.json",
    "contentDigest": "sha256:2f238f414cb49fe3c5e559e3be7f229c473d51ad1ab76504aa0fa6a445e8be12"
  },
  "oracleRef": {
    "fixtureId": "oracle:TS-ID-104:r1",
    "path": "evals/v2/fixtures/oracles/ts-id-104.r1.json",
    "contentDigest": "sha256:a9d61b3cd334ab89ec247fdef1db9b502aa4ef27c1da6f6ae37b3f234b4fbc05"
  },
  "evaluatorBindings": [
    {
      "evaluatorId": "deterministic-safety",
      "version": "1",
      "contentDigest": "sha256:41deac3c68b5c318092fbb92bd57004ab7223413567bc617106c2c6ed01f189d",
      "kind": "deterministic",
      "criterionIds": [
        "identity.scope-safe",
        "observation.source-bound",
        "memory.provenance",
        "terminal.truthful"
      ],
      "requiredForGate": true
    },
    {
      "evaluatorId": "human-workflow",
      "version": "1",
      "contentDigest": "sha256:8ad4277fb7346dfb4da477ce0c7db4481c5f2e4d8260713515a8dbd81b703174",
      "kind": "human",
      "criterionIds": [
        "workflow.uncertainty-visible",
        "workflow.correction-burden"
      ],
      "requiredForGate": false
    },
    {
      "evaluatorId": "model-soft-quality",
      "version": "1",
      "contentDigest": "sha256:dc52dbcafc6e3dd848f916b68c6b7c8c6bad2e9fe927983baecaadfc3517f885",
      "kind": "model",
      "criterionIds": [
        "quality.clarity"
      ],
      "requiredForGate": false
    }
  ],
  "slices": {
    "capability": "identity",
    "layer": "E2_identity",
    "modality": "synthetic_identity_clues",
    "defaultProfileId": "identity-replay-v1"
  },
  "lineage": {
    "sourceKind": "native",
    "sourceIds": [
      "PRD-2026-09-01#TS-ID-104"
    ]
  },
  "compatibleProfileIds": [
    "identity-replay-v1",
    "model-replay-v1"
  ],
  "criterionAdjudications": []
}
